brand_id,brand_name,given_brand_description,given_brand_website,brand_website,brand_instagram_link,brand_recipes_url
5cdb89e4-53af-4147-b75e-d499d9531182,Jla Global Inc,,http://www.jlaglobal.com,http://www.jlaglobal.com,,
b6736085-267e-4bb3-a306-d8554adbda8e,Amici's Italian Bistro,,http://www.amicisscottsville.com,http://www.amicisscottsville.com,https://instagram.com/amici.italian.restaurant,
4cb797fa-7a2d-419c-bb3a-c1cac39ab77d,Classic Foods,,http://www.classic-foods.com,http://www.classic-foods.com,https://instagram.com/classicfoodsportland,
920c734b-a847-4e0a-a9e8-0dec36aaa949,The Corner Pub & Grill,"The Corner Pub & Grill is an award winning bar and restaurant chain based out of St. Louis, MO with 3 locations in Valley Park, Chesterfield & O' Fallon. The Corner Pub & Grill offers a large menu with a wide variety of items as well as an extensive Gluten Free menu.",http://www.cornerpubandgrill.com,,,
8c0fc0bb-7219-443b-b8bd-0ade4ad028a1,"Kaufhold's Kurds, Inc.","Our Hand-breaded cheese curds are made in Ellsworth, Wisconsin, and sold throughout the country. We've been family-owned and operated since 1995, we don't mess around when it comes to curds. Which means no preservatives, no machines, no-nonsense. We bread our curds in small batches by hand within a day of when they're made to lock in that peak freshness and drool-worthy flavor that will have your customers asking for seconds. And thirds.",http://www.kaufholdskurds.com,http://www.kaufholdskurds.com,https://instagram.com/kaufholdskurds,
4b1f2d01-1959-4517-9ff1-a4890c7790b9,Fast Eddies Diner,,http://www.fasteddiesdiner.com,http://www.fasteddiesdiner.com,https://instagram.com/fasteddiesmd,
0857e382-d1ec-4155-8215-2cfde5f4527f,"MBGO, Inc. dbs Doc Greens Gourmet Salad and Grill",,http://www.docgreens.com,http://www.docgreens.com,,
3ac8efe8-c7b3-409b-8d29-e17bfc449200,JFS/Curtze,"JFS/Curtze is a full line food service distributor.  We offer a unique center of the plate program which includes portion control fresh meat in a custom cutting federally inspected meat facility, as well as a custom cut fresh seafood program.   We are a leader in food safety,   going above the standard requirements to earn a Top Rating by Silliker on a third party audit.

In addition to canned goods, frozen foods, paper products, chemicals, equipment, supplies, dairy and other staples, we offer temperature controlled fresh produce distribution.  Our commitment to quality and customer satisfaction has earned us a reputation as the ""Food Service Distributor of Choice"".   For over 135 years we have been committed to this goal and it has been a key element of our continued growth. Today we proudly serve 8 states.",http://www.jfsfoods.com,,,
640e4417-537e-4b01-9d3c-f3c32c8e8c0b,Freds At Barneys New York,,http://www.fredsbarneysny.com,http://www.fredsbarneysny.com,https://instagram.com/fredsatbarneys,
0748af77-1f06-448e-94ac-8cbe77896357,The Good Pour,"At The Good Pour™, you get to choose which charity receives a portion of our profits. But we're not asking you for donations or rounding up your receipt. In an unprecedented move, we're inviting you to dip into our pockets and direct where the funds go. You pick the charity, then we all share in the joy of giving. It's our pledge to offer a premier wine and spirits marketplace. And it's our purpose to give back.",http://www.goodpour.com,,,
548e6bec-152d-4705-9885-49d01904768e,Columbus Gardens,,http://www.columbusgardens.com,http://www.columbusgardens.com,,
2f44a34b-abb0-4bad-b847-3e97e5e7189a,"E.E. WINE, INC",,http://www.eewine.com,http://www.eewine.com,,
fff9398e-d5c4-44fb-91fb-8d4aeca50053,PT Cinta Air Minum Alexa Pure Water,"Using Reverse Osmosis Technology for healthy kidney. SNI, BPOM & HALAL certification drinking water and All the distribution are protected from sunlight and vehicle emission.",http://www.alexapure.com,,,
87b93248-1fab-408b-bc6e-6fbebdc5a84b,"Johanna Foods, Inc.",,http://www.johannafoods.com,http://www.johannafoods.com,,
d913c848-b4b7-4dde-925c-a2f70e3f88ee,El Hefe Super Macho Taqueria,,http://www.elhefe.com,http://www.elhefe.com,https://instagram.com/elhefescottsdale,
a92200f7-28d2-48fd-ace9-f34eec4f7741,The Club at Hillbrook,"The Club at Hillbrook, a private 50-acre estate, is located minutes from Chagrin Falls, Ohio at the end of a picturesque country road. The Club at Hillbrook is a full-service club, offering a wide range of services including fine-dining, accommodations, tennis, pool, fitness, weddings and corporate events.",http://www.clubhillbrook.com,,,
bc60fbe4-7b9a-41d3-96b7-1e1cb7c75605,Abundance Bakery,,http://www.abundancebakery.net,http://www.abundancebakery.net,,
97eac0a1-ad86-481f-9d5e-dad0a54b3e56,Java Joes Coffee,"Java Joes Coffee is an Entertainment company located in 1 Public Market, Rochester, New York, United States.",http://www.javajoescoffeehouse.com,,,
9ef8ccf2-98ae-494e-86ba-575434e7690c,john f martin and sons,john f martin and sons is a company based out of United States.,http://www.johnfmartinmeats.com,,,
a59d84a9-564d-4699-a43e-0d568b0ece3a,JJ Buckley Fine Wines,"JJ Buckley Fine Wines is a pioneer in the rapidly growing world of web-based wine merchants. Founded in Oakland, California, JJ Buckley Fine Wines offers premium wines to discerning customers like you across the United States. With over 600,000 wines passing through our 43,000 square-foot retail operations every year, JJ Buckley uses its tremendous reach in combination with a stellar selection, outstanding value, service and knowledge to create a unique and personalized experience. All thanks to our wine specialists who are at your disposal and always ready with recommendations to suit your tastes or occasion.",http://www.jjbuckley.com,,,
17eff7b0-39a6-46be-9c0b-1604dd6c0e8f,"John I. Haas, Inc.","John I. Haas, Inc. is North America's leading hops supplier. As a member of the BarthHaas Group – the world's largest supplier of hops, hop products and services – Haas has the global reach to offer the products, tools, services and supply assurance you need to brew successful beers.",http://www.johnihaas.com,,,
65f81bc9-4ca7-4082-aaaf-bcf0da7c6576,BonBon - A Swedish Candy Company,,http://www.bonbonnyc.com,http://www.bonbonnyc.com,https://instagram.com/bonbonnyc_,
50ca4f74-257e-4abf-a6db-8c381ade5b8b,United Dairy,"United Dairy is a Legal Services company located in 800 S 4th St, Martins Ferry, Ohio, United States.",http://www.drinkunited.com,,,
ecf81a34-9836-463f-b78b-4b90f26c0a7a,Haby's Alsatian Bakery,,http://www.habysbakery.com,http://www.habysbakery.com,,
f78c1f1c-ed17-4f49-a7e9-fa9fa7316902,Cathedral Ridge Winery,,http://www.cathedralridgewinery.com,http://www.cathedralridgewinery.com,https://instagram.com/cathedralridgewinery,
473b6508-f1af-4e87-b032-62fb83b6b38f,Clinica Union,,http://www.clinicaunion.net,http://www.clinicaunion.net,,
b4e7ed8b-7a59-4a1e-8655-ec924bcf52c8,Abc Bakery,,http://www.abcbakerysac.com,http://www.abcbakerysac.com,,
c0d3f9d1-77f9-445d-b28b-ae12fb83f9ba,Great Buns Bakery,,http://www.greatbunsbakery.net,http://www.greatbunsbakery.net,https://instagram.com/greatbunsbakery,
aedea844-74d4-4976-bfa5-3fbb41374c6f,Rattan Enterprises,"Industrial Filter Bags manufacturers  Rattan Enterprises suppliers of Fluid Bed Dryer, Industrial Filter Bags manufacturing, indian Centrifuge Filter Bags manufacturer, wholesale Industrial Filter Bags suppliers, Fluid Bed Dryer from india, Industrial Filter Bags, Fluid Bed Dryer, Centrifuge Filter Bags.",http://www.filterbags.in,,,
927a6bcd-ce3f-4cde-a0cb-00bf8a60221a,JeJe Mediterranean Grill,"⏰Open Daily ⭕️10AM-9PM
🥙Serving Fresh Mediterranean Cuisine
💯Halal Food
🌱Vegan Options
🏅Yelp Top 10 in Granada Hills
🥇Best Kebab Specialist in LA
Fresh, tasty, and healthy. Join us for an unforgettable meal in a relaxing, modern environment. Join us for lunch or dinner with family.",http://www.jejemedigrill.com,,,
b8c33f07-6af6-41d1-a40a-c7ed051193c3,DALES BAR AND GRILL INC,,http://www.dalesbarandgrill.com,http://www.dalesbarandgrill.com,https://instagram.com/dalesbarandgrill,
d0fa98d1-59d7-4cd9-b176-99c6b765d01f,Kegs and Barrels,"Kegs & Barrels is Dallas-Fort Worth's premier specialty premium beer and wine retail store. We are a growing business, with two retail stores in Plano, Texas. We believe a great selection of beer and wine, great service and great prices will make us your favorite beer and wine store in the Dallas area, serving loyal customers in Allen, Dallas, Fairview, Frisco, McKinney, Plano, Richardson, Sachse, and Wylie!",http://www.kegsandbarrels.com,,,
f6b395b4-0396-4eb5-9d7b-8e3ac51e6eed,The Mini Donut Company,"The Mini Donut Company is a chain of mini donut shops originally founded in San Diego. Our delicious mini-donuts can be ordered for pickup or delivery on our website or you can visit us at one of our in-person locations.  And remember...Donut Worry, Be Happy! 

Why mini donuts, you ask?  Think of anytime someone has brought donuts to the office. All those donuts end up cut in thirds because no one wants to be ""that person"" who takes an entire donut. Well, that's not a problem anymore.  Our mini donuts are bite size. Take one (or two or three!) and feel no shame!

Looking to score points with the boss? Get donuts.
Want to be the popular one in your department? Get donuts.
Score some points on your first day? Get donuts.
Need to liven up a boring meeting? Get donuts.
Screw up the TPS reports and need to be make up for it? Get donuts.
Have a big presentation today and want to butter up your audience? Get donuts.

The answer is always get donuts.",http://www.getminidonuts.com,http://www.getminidonuts.com,https://instagram.com/getminidonuts,
04851659-2587-4e8d-86a6-51502d6ab07e,JAYCEE HERB TRADERS (USA) LTD.,"Jaycee Herb Traders Ltd. provides culinary fresh herbs, edible flowers and herb mixes to the retail, wholesale and food service markets and we offer our products in bulk, bunches and individual packages.",http://www.jaycee-herb.com,http://www.jaycee-herb.com,https://instagram.com/jayceeherbs,http://www.jaycee-herb.com/recipes/
eb9f8bc6-053f-4108-be26-6a8474f5c221,Panaderia El Hornito,,http://www.gordosbakery.com,http://www.gordosbakery.com,https://instagram.com/loshornitosbakery,
75a26a44-2815-4bc2-99a9-76ddc944f92f,New Horizons Baking Company,"Founded in 1967 as the West Baking Company, New Horizons Baking Company, is a hamburger bun & English muffin producer for the largest QSR in the US. With two high speed food manufacturing facilities in Northeast Ohio and Northern Indiana, New Horizons produces quality products daily for over 5000 restaurants, food service facilities and wholesale establishments. The company has grown exponentially under the successful leadership of Tilmon (Tim) Brown since 1995. With substantial investments in capital projects and human capital resources New Horizons has labeled itself as ""the Baker's Baker"" and supports a variety of iconic brand customers.",http://www.genesisbaking.com,,,
cfe52d0e-05bd-4947-9028-33b0550eebbd,Ranch Market,,http://www.alamoranchfarm.market,http://www.alamoranchfarm.market,https://instagram.com/99ranchmarket,
1663325e-f432-4723-a453-d68a349d7be3,Circle Beverage,,http://www.circlebev.com,http://www.circlebev.com,https://instagram.com/circlembeverage,https://www.circlebkitchen.com/food-and-recipes/2013/9/17/coctel-de-camaron-mexican-shrimp-cocktail.html
97621118-4576-4206-81a7-2cbfed1948c7,"Mid-Wisconsin Beverage, Inc","For more than 80 years, we have been locally owned and operated as an independent Pepsi-Cola franchise distributor serving 15 counties in North Central Wisconsin. Looking to the future, we have also expanded our reach of reliable services, delivering coffee and related products to areas beyond those 15 counties.",http://www.cool-drinks.com,,,
5fc70411-86ed-4608-b10a-1373f91e45cd,CANDY LAND LTD,,http://www.candylanddelivery.com,http://www.candylanddelivery.com,https://instagram.com/candyland1932,
71c491fb-70e4-46cd-8ad7-882c2d0d1227,Fort Leavenworth Commissary,,http://www.fortleavenworthhousing.com,http://www.fortleavenworthhousing.com,https://instagram.com/fortleavenworth,
81748f8b-298c-4f22-ae3f-9d64812401a5,Sprinkles,"OUR STORY IS A SIMPLE ONE.
Before 2005, our family spent their summer days eating the same frozen treats as every other American family. We enjoyed shaved ice with fruit juices, single and double popsicles, and peanut butter cups among other old-time favorites.

Then came the summer of 2005. The heat was relentless, and all the time-honored refreshment treats couldn't spare us from the triple-digit temperatures. It was then that we decided to dive into the world of ice cream and give our own brand a shot. We started out by mixing fresh milk with creamy melted chocolates and added crushed nuts to make our very first milkshakes. From there, things quickly took off.

Today, the Sprinkles lineup of more than 300 ice cream products is still produced by our family. Little has changed since the beginning, although we now operate our very own beautiful, state-of-the-art factory in Hackensack, New Jersey. Oh, and we've also added a few members to our family since.",http://www.ilikesprinkles.com,http://www.ilikesprinkles.com,https://instagram.com/sprinklesicecreamus,
61812665-a31b-48e2-80fe-16e7ef221dc1,Shipwreck Cove,,http://www.grassbladescomic.com,http://www.grassbladescomic.com,,
5c7b46c4-892d-4375-a303-e553e034afa0,Salted,"Salted is a platform for scaling tomorrow's restaurant brands.

We believe the future of restaurants doesn't look anything like what we see today. The most successful brands will exist outside four walls and will develop loyal customers through technology and exceptional, multi-channel food experiences. For more information, please visit: hellosalted.com.",http://www.hellosalted.com,,,
ead2cdbf-05c7-4eef-98d6-3d8fe15b87a4,Kabab Paradise,"We make Extra Delicious Halal Kababs and Burgers!

100% Zabihah Halal

We are a halal food provider serving all types of food that is perfect for everyone of all ages. Our company is a family built organization where the quality of our service, our food, and the satisfaction of our great customers come first in our priorities.  Everything we make is made with LOVE.",http://www.kababparadise.com,,,
67628d22-d30a-48f8-9514-386b8aeaf487,"Johnson Foods, Inc.",,http://www.johnsonfoodsinc.blogspot.com,http://www.johnsonfoodsinc.blogspot.com,,
d29fcb66-aed9-4bc6-8fcd-1484ad71406d,Sunnie,"100% organic fresh snacks made for the in-between moments.  
Because you never outgrow snacktime.",http://www.feelsunnie.com,http://www.feelsunnie.com,https://instagram.com/feel.sunnie,
7954d8fe-a66c-4d79-9364-dc324440eaad,Burp!,,http://www.eatatburp.com,http://www.eatatburp.com,,
666a3306-d843-4984-b50e-f38fd6d8777e,"Kabobs, Inc.","Originally founded as a quick service restaurant in South Atlanta, Georgia, Kabobs served its patrons with tasty / unique skewered meat and vegetable brochettes. Today, Kabobs, The Hors d'oeuvre Specialists, is revered as the industry leader in hand-crafted, gourmet hors d'oeuvres. For over 30 years Kabobs has been entrusted by countless food service establishments and institutions throughout the United States, Canada, and the Caribbean in creating unique dining experiences and hailed by customers for our high quality, innovation and customer eccentricity.  Operating out of a state-of-the-art operational facility, practicing rigid HACCP and USDA quality initiatives, Kabobs'​ team of culinary professionals has created an expansive menu offering consisting of a database that captures over a thousand unique recipes. Whether your style is contemporary or classic, Kabobs'​ professional chefs prepare hors d'oeuvres and entrees with the same care, consistency and confidence, every piece, every time.",http://www.kabobs.com,,,
8467fb25-fee4-4bd9-a64a-d6a2edce51d4,Dot's Market,,http://www.dotsmarketsdetroit.com,http://www.dotsmarketsdetroit.com,https://instagram.com/dotsinmaine,https://dotsmarket.com/recipe/honey-roasted-ham/
d5b006e3-6caa-442f-ba2f-06fc151b1582,Jordano's Foodservice,"More than 100 years ago, Jordano's opened for business in Santa Barbara and a rich tradition of innovation, customer service and integrity was born. Today, Jordano's is the 2nd largest independent broadline foodservice distributor in California and the leading independent foodservice distributor in Central and Southern California.

Our sales and distribution network covers six key Central and Southern California counties, including Santa Barbara, Ventura, Los Angeles, Orange, San Luis Obispo, and Kern. Jordano's 45-person sales staff includes five regional managers as well as individual specialists in equipment and supplies, gourmet coffee, chemicals, gourmet and specialty foods, produce, seafood, and center of the plate. 

Jordano's customer base covers more than 37 different market segments; including restaurants, wineries, caterers, schools, colleges and universities, hotels, pizza chains, resorts, casinos, bars, golf courses, health clubs, and government agencies...plus a marine and export department that handles our offshore business.",http://www.jordanos.com,,,
e54a9651-7372-499d-98fd-8abebcd00c97,Jim Beam American Stillhouse,Discover the secret behind the world's No. 1 Kentucky bourbon. At Jim Beam you'll come as a friend and leave as family.,http://www.americanstillhouse.com,,,
e9f063fc-d72e-4814-8262-4ddc317e15cb,The Original Limu Company,"The Limu Company has developed the first and only proprietary technology for extracting Fucoidan in a form that's usable by the body without destroying Limu's other delicate, but extremely powerful nutrients.  Over 800 research studies on www.pubmed.org

In fact, every bottle of Original Limu is 83% pure reconstituted Tongan Limu, with every vital nutrient intact for fast integration into the human body.

Our exclusive recipe - containing an all-natural blend of papaya, mango, pear, and apple - and our proprietary chill-blending technology, guarantees that every serving is as delicious as the last. Even children love it! The delicious tropical flavor of Original Limu contains no added sugar and no artificial sweeteners, colors or flavors.

The result? A breakthrough ... golden-colored ... life sustaining beverage ... that cannot be duplicated! It's amazing what a difference just 1 to 4 ounces of this refreshing beverage twice a day can make. Savor just one sip and you'll know it's not only good for you, it's just plain good. Think of it as nature's gift to your immune system.

Thousands of people across the globe ... people of all ages and levels of health ... are experiencing one of nature's most precious - but difficult to harvest - gifts. So how can The Limu Company deliver this delicious golden nectar that's taking the world by storm to you?",http://www.discoverlimu.com,http://www.discoverlimu.com,,
471b590b-b2f3-42e2-b676-7959aa4ae883,LA MAISON DU FOIE GRAS,"Depuis 1989, LA MAISON DU FOIE GRAS a développé un savoir-faire dans la production du foie gras de canard qui lui a permis de consolider sa position de leader sur le marché marocain. De l'élevage des canetons importés de France à la réalisation de produits finis, la chaîne de production est complètement intégrée.

La gamme de produits proposée se diversifie au fil des années et se développe pour répondre à la demande d'une clientèle exigeante. Celle-ci est constituée des clubs de vacances, palaces, traiteurs et restaurants les plus prestigieux sur l'ensemble du territoire marocain. Cette maîtrise des produits issus du canard gras lui a permis de développer son marché à l'international, ainsi la marque est présente dans plusieurs pays du monde arabe : Tunisie, Émirats arabes unis, Koweit, Qatar.

Les perspectives d'avenir concernent les marchés du Proche-Orient halal, en attendant l'ouverture des marchés européens.",http://www.foiegras.ma,http://www.foiegras.ma,https://instagram.com/lamaisondufoiegrasmaroc,
cfcf229a-5c78-4f3c-abe3-128f34a2a7da,Camille's,,http://www.camilles.la,http://www.camilles.la,,
6b55d33a-0e2a-4166-bac3-d386780b3ff4,LA TONALTECA,"LA TONALTECA is a company based out of 46 Viewmont Mall, Scranton, Pennsylvania, United States.",http://www.authenticmex.com,,,
3ae8987e-bb2d-47ad-9e0c-f3f9bedf9b93,Bremer Authentic Ingredients,,http://www.bremeringredients.com,http://www.bremeringredients.com,https://instagram.com/bremereg,https://bremeringredients.com/category/baking/
58a146c6-7d39-4d1d-b203-6dfaf80d60e7,DAIKAYA LLC,,http://www.daikaya.com,http://www.daikaya.com,https://instagram.com/daikaya_ramen,
627d6927-4c02-48a2-959e-8d08708b926c,Renaissance West Community Initiative,,http://www.communityculinary.org,http://www.communityculinary.org,https://instagram.com/ccscencore,
5c0904ce-2e74-4652-8d56-411c7e0a7c15,VYBES,We make drinks for mind & body. Drink Afternoon Energy and feel better.,http://www.idrinkvybes.com,http://www.idrinkvybes.com,https://instagram.com/idrinkvybes,
500512fb-9453-479d-85d4-79b9a65084f5,BAGEL BAKERY,,http://www.bagelbakerygainesville.com,http://www.bagelbakerygainesville.com,,
62fb0276-a464-4ba3-bf2d-b4b95535a7a0,Karat® by Lollicup™,"Karat® by Lollicup™ (Nasdaq: KRT) is a rapidly-growing manufacturer and distributor of environmentally friendly, single-use disposable products, primarily used in restaurants and foodservice settings. The company supplies a wide range of products for national restaurant chains, as well as smaller, regional chains. Karat's products include food packaging, containers, tableware, cups, lids, cutlery and straws. The company also provides additional environmentally friendly options to sustainably-conscious customers.",http://www.karatpackaging.com,,,
fcf9d797-6fe8-450e-88a0-3a0f5084a0f0,The Dutch Mill,"The Dutch Mill is a Food and Beverages company located in 2901 Dewey Ave, Rochester, New York, United States.",http://www.dutchmillvt.com,http://www.dutchmillvt.com,https://instagram.com/thedutchmillhotel,
c64f2e47-3f9b-4485-ac70-8a4ecad9be97,The Dinner A'Fare,,http://www.dinnerafare.com,http://www.dinnerafare.com,https://instagram.com/dinnerafare,https://www.dinnerafare.com/recipes/
fd173be6-d797-404e-824f-f8ee73416326,The Great Lakes Coffee Roasting Co.,"COFFEE IS NO LONGER A COMMODITY

It defines a community. It tells their story. Local. Global.

Everywhere in-between.

So at The Great Lakes Coffee Roasting Company, we've made it our business to help tell that story. The whole story. And that, in turn, is how we tell ours. Like many great American brands, we began in a garage with not much more than a leap of faith — and our Italian father. His passion for the art and science that transformed those little green beans into the nuanced roasts we still offer is what inspires everything we do, every day, at our ever innovating roasting facility. But our story doesn't end there. After all, if you're traveling the globe to source only the finest and most responsibly grown coffee, it's no longer just your story. It's that farmer's story. And his family's story. It's a story about our relationship and responsibility to their passion for caffeinated excellence. It's also a story about how those people on the other side of the planet are helping to change the story in Detroit.

Here, with each grind and every pour, in the conversations we have and the discussions we lead, we're refining the grit of a great city into the ideas that are redefining what it means to be an even greater community. So whether you're sipping from your favorite mug at home or savoring that last drop at one of our bars, know you're part of our story. Because at The Great Lakes Coffee Roasting Company, it's not just about what you're drinking: It's about the journey to your cup… And where we'll go from there.",http://www.greatlakescoffee.com,http://www.greatlakescoffee.com,https://instagram.com/greatlakescoffee,
7d051c95-ede4-4143-b7ac-1cd6ca3ce398,Fulton Stall Market,,http://www.fultonstallmarket.com,http://www.fultonstallmarket.com,https://instagram.com/fultonstallmarket,
1354288c-10dc-46c1-80da-7bfd3477061d,Cook Philly,,http://www.audreyclairecook.com,http://www.audreyclairecook.com,https://instagram.com/audreyclairecook,
bdfcc59c-b7c7-41e3-a9f4-eb405f6696a9,The Bakers Dozen,,http://www.bakersdozenyale.com,http://www.bakersdozenyale.com,https://instagram.com/bakersdozenyale,
8aedf479-9ee0-4d7d-922a-92ad8fe11abf,L&L Hawaiian Barbecue,"Founded in Honolulu as L&L Dairy in 1952, L&L became a popular eatery in Hawaii. The iconic L&L Hawai‘i brand was established in 1976 by Eddie Flores, Jr., who with partner Johnson Kam grew the company into the most popular international restaurant franchise specializing in Hawaii cuisine. Today L&L Hawai‘i offers Hawaiian-style comfort food and hospitality at its over 200 locations throughout 15 states and Japan. For more, visit hawaiianbarbecue.com.",http://www.hawaiianbarbecue.com,,,
740a0bc5-b109-477c-9db5-1ecdb521d912,National Pretzel,"HK Anderson Prtezels is an authentic American pretzel company that delivers tasty, premium, high quality, innovative pretzel snacks.",http://www.hk-anderson.com,http://www.hk-anderson.com,,
