brand_id,brand_name,given_brand_description,given_brand_website,brand_website,brand_instagram_link,brand_recipes_url
156d23ba-9043-45e8-b1ce-b02020dd625b,John Wm. Macy's,"John Wm. Macy's is a manufacturer of specialty baked snacks based in Elmwood Park, New Jersey.  Our signature lines include John Wm. Macy's CheeseSticks, CheeseCrisps and Grilled Crostini Toasts.

Our snacks are made with hand-mixed sourdough, aged sharp Cheddar cheese, and then twice baked for that perfect crunch!",http://www.johnwmmacys.com,http://www.johnwmmacys.com,https://instagram.com/johnwmmacys,https://www.johnwmmacys.com/pages/recipes-01
38e4b35d-77fd-4c30-a0e4-b5d6b964530f,Creekside Springs,,http://www.creeksidesprings.com,http://www.creeksidesprings.com,,
8f2e3fe5-b0c3-4ea7-a5c2-12d8b6fac429,Bamboo Sushi Bar & Hibachi,,http://www.bamboocrestview.com,http://www.bamboocrestview.com,,
82893c9f-0080-4378-bf36-be2d4221fe06,Jody's Inc.,,http://www.jodyspopcorn.com,http://www.jodyspopcorn.com,,
6f556a81-3136-4e70-987a-6b847593d290,Future of Food Events,,http://www.futureoffoodevents.com,http://www.futureoffoodevents.com,,
85a968a7-7808-491a-b767-b8f648510621,Kreimers Bier Haus,,http://www.bierhauswest.net,http://www.bierhauswest.net,https://instagram.com/kreimers_bierhaus,
723c3f38-a8fd-47c6-812e-280ca4565541,Electricity Board,,http://www.jatc110.org,http://www.jatc110.org,,
f251a619-3225-4789-9c36-546ab71cfca4,Texas Beef Council,"Beef Loving Texans is the consumer-facing brand of the Texas Beef Council, which supports the state's beef industry by increasing beef demand through promotion, research and education.

The Texas Beef Council (TBC) is a non-profit organization charged with the promotion and marketing of beef and beef products. TBC is funded by Texas farmers and ranchers through the national Beef Checkoff program and the Texas state Beef Checkoff program. Checkoff dollars are used to increase domestic and/or international demand for beef through programs of promotion, research and education. The organization is directed by a 20-member board of cattlemen, representing the state's 149,000 beef farmers and ranchers.

Commitment to the Community:
We at Texas Beef Council will do our best to make sure the postings on our page are in line with our mission. We expect that users will not post content that falls into the following categories and reserve the right to remove postings that are:
- abusive, defamatory or obscene
- fraudulent, deceptive or misleading
- in violation of another's intellectual property right
- in violation of any law or regulation
- otherwise offensive

The views, opinions, depicted results and experiences expressed in user-submitted comments are solely those of the author. To encourage community conversation, user comments are not edited for accuracy or safety. However, to ensure a continually positive experience for the community, we may report or remove content or commentary containing spam, profanity, or otherwise objectionable or prohibited material subject to the Facebook Code of Conduct and Terms of Use.",http://www.beeflovingtexans.com,http://www.beeflovingtexans.com,https://instagram.com/beeflovingtexans,https://beeflovingtexans.com/recipes/
797e6dc4-706d-43e5-9be2-527c92cdb2ab,"SimplyFresco, LLC","SimplyFresco, LLC was originally founded in December 2005. From its inception, SimplyFresco, LLC has undertaken a pioneering effort to produce the very best refrigerated fresh HPP (High Pressure Processed) salsa available on the retail market. Our ambition is to satisfy consumer needs for fresh, healthy, safe, convenient, and affordable salsas that taste great! We believe that appetizing food on the table brings families and friends back together!

In 2010, The Sands, a well known San Antonio family with an extensive background in the retail food industry, primarily salsa, joined SimplyFresco, LLC and began the journey of taking the fresh salsa company to a whole new level.

The Fall of 2012 brought many exciting changes to SimplyFresco, LLC when they launched their new Cocina Fresca Cantina Style line to the retail market. This line currently includes Mild Jalapeno, Medium Serrano, Medium-Hot Habanero, and Mild Sweet Onion. Today, this line continues to grow strong as more and more consumers are reached! We know that once you taste it, you will love it!""",http://www.cocinafresca.com,http://www.cocinafresca.com,https://instagram.com/cocinafrescasalsa,
100a43e6-5183-4262-b05d-310706a5b611,JOEL GOTT WINES,"JOEL GOTT WINES is a company based out of 1230 PINE ST, SAINT HELENA, California, United States.",http://www.gottwines.com,,,
ef89038e-2891-4186-9e7c-8746226adbe8,The Food Co-op,We are a member owned cooperative selling natural and organic foods.,http://www.foodcoop.coop,http://www.foodcoop.coop,https://instagram.com/ptfoodcoop,https://www.foodcoop.coop/recipes
b4242e03-941c-43ad-8756-b7aa2b365a35,Justin's,"Established in 2004 in the home kitchen of health enthusiast Justin Gold, Justin's supports an on-the-go lifestyle with an extensive line of naturally delicious, high-quality nut butter and USDA-certified organic chocolate treats. Justin's is known for delivering delicious taste, a ‘one-of-a-kind' grind texture and convenient nutrition. For more information about how Justin's is building a collective that is nuts about making the world a more resilient, well-fed place, visit Justins.com.",http://www.justins.com,http://www.justins.com,https://instagram.com/justins,https://www.justins.com/recipes/
53d34e21-f4ec-45d8-8dc6-34d59f91f0cd,Willies Bar,"Willies Bar is a Food and Beverages company located in 1105 S Beacon St, Dallas, Texas, United States.",http://www.gwilliesbar.com,,,
76bf4b24-c99b-45b0-ae40-6f3ecad71e72,Dennys Classic Dinner,,http://www.dennysdiner.com,http://www.dennysdiner.com,,
4baeb870-9ad9-4a91-a9d7-28ce6d40dbe0,Glacial Till Vineyard,,http://www.glacialtillvineyard.com,http://www.glacialtillvineyard.com,https://instagram.com/glacialtillvineyard,
c5c00279-775f-487c-bfc1-1259a9efe8d2,Huxtables Kitchen Inc,,http://www.huxtables.com,http://www.huxtables.com,,
d2084864-d57c-4b8d-b74e-36b7968e6b4f,Julio's Liquors,"At Julio's Liquors we offer 17,000 sq. ft. of spectacular shopping in downtown Westborough, MA. With a wide variety of fine wines, spirits, beer, and tobacco, we also have many other unique items that set us apart from the average liquor store. 

Our wine department carries over 4000 labels from 16 different countries. 
Our Beer department contains one of the largest selections of microbrews, domestics, imports, Belgians and Trappist beers, totaling over 1,500 beers in stock! 
Our Spirits department carries many hard-to-find items from single malt scotches to high-end vodkas and gins. We also house the Vigilant Smoke Shop, a state-of-the-art, full-service smoke shop with a knowledgeable, well trained friendly staff to cater to all of your tobacco needs. 

In addition to having one of the largest selections of product, we offer our customers a unique shopping experience with our Angel Share Tasting Room, Jim Beam Cold Storage Warehouse, and Vigilant Smoke Shop. Our Angel Share Tasting Room has 40 wines on tap all the time. The tasting room is completely free of charge, and allows our customers to try before they buy. 
The Jim Beam Cold Storage Warehouse is a vintage spirits tasting room fashioned after a 1920's and 1930's speakeasy. Every Wednesday [""Whiskey Wednesday""] we offer free whisky tasting to the public. By utilizing our whisky-centric blog site www.lochandkey.com as well, you can follow up with friends after the tastings!",http://www.juliosliquors.com,,,
264198ed-8ed1-49cd-81fc-49d12a62693a,JEE Foods,"JEE Foods is a Non-Profit Company designed to collect, process, and re-distribute food that would otherwise be wasted at local grocers and offer free and reduced cost meals in an attempt to solve the hunger and poverty problem in the Greater Cincinnati Area.",http://www.jeefoods.org,,,
573b4887-cf4a-4395-9370-fb0d72ffb026,Louis Glunz Beer Inc,"Louis Glunz Beer Inc is an importer and distributor of the finest beer in the world.  As a distributor we service the 8 counties surrounding Chicago for over 75 Supplier.  Representing both domestic macro, national craft, regional craft and importer beers.

Mission Statement
Through the efficient utilization of our highly motivated and trained employees, Louis Glunz Beer Inc., a professional beverage distributor, will strive to provide exceptional representation of all of our suppliers, while providing our customers unsurpassed customer service, for every sale on every call.

Vision Statement
Louis Glunz Beer, Inc. is always striving to be Chicagoland's best (premier) beverage distributorship. Our representatives will cultivate a supplier and retailers maximum potential while capturing, processing, loading and delivering each and every order timely and accurately.

Pillars of Success

Knowledge - The Glunz Team member is an Educated Beer and Beverage professional whose passionate counsel should display open mindedness, while being creative, innovative, insightful and resourceful.

Integrity - A Glunz Team member should always be honest, trustworthy, respectful and dependable.

Stewardship - As proud members of the Glunz Team we are held accountable for leaving our work environment, our customers' accounts, our suppliers portfolio better than it was before. What is the one last thing we can do to make sure we are successful?

Respect - We need to constantly demonstrate, to our value chain, through perseverance that we are interested, reliable, dedicated, and punctual.",http://www.glunzbeers.com,,,
3cd711c5-62ae-4175-9830-7b563eb5b2f6,NextDay,"Our science-backed, pocket-sized beverage helps you feel better no matter where your social obligations take you.",http://www.getanextday.com,,,
6358de1c-5ef9-45e9-9ef7-885a5f3640a2,Jumbo Beverages,"Welcome to Jumbo Beverages, the leading beverage distributor in North Texas. Due to years of industry experience and strong ties to our community, we're notorious for our long-standing relationships and our unwavering dedication to serving our people.

Jumbo Beverages covers 25 counties across North Texas. We carry a robust brand portfolio and we're honored to represent over 20 incredible beverage suppliers.   

While we're still a fresh name in today's market, we can trace our roots back over a hundred years. Our name, ‘Jumbo Beverages', was inspired by the original flavored soda company, ‘Jumbo Bottling Company', founded by Louis Glazer in 1909. As an entity under Glazer's Beer & Beverage, we're proud to have the privilege of honoring the past while looking towards the future.",http://www.jumbobev.com,,,
ff3a1efd-f75c-4424-a82f-389358723583,"Cameco, Inc.",,http://www.camecoinc.com,http://www.camecoinc.com,,
07de65f7-0000-424d-8a13-d1f4343c98f4,"Magic Road International, Inc",,http://www.estancialucia.com,http://www.estancialucia.com,,
46fd947f-0410-40ab-8911-0fd43ca6e1f2,GTC Nutrition,,http://www.gtcnutrition.com,http://www.gtcnutrition.com,,
40d8d128-8ac0-45df-818e-6b7131c68ca1,Joes Italian Ice,Joe's Italian Ice,http://www.joesice.com,http://www.joesice.com,https://instagram.com/joesice,
771f34f3-e4f9-4772-bf18-4f3be7aebbe4,Hudson Valley Food Brokers,,http://www.hudsonvalleyfoodbrokers.com,http://www.hudsonvalleyfoodbrokers.com,,
e00a43c0-2015-42dd-9983-5798d83b20e0,Chick N Max,,http://www.chicknmax.com,http://www.chicknmax.com,https://instagram.com/chicknmax,
6f8a315e-54de-4ecd-869e-421d371e5771,Plantain Products Company - Home of Chifles,"Chifles was established in 1963. A family-owned business that offers gluten-free, cholesterol-free, 100% vegan snacks.",http://www.chifleschips.com,http://www.chifleschips.com,https://instagram.com/chifleschips,
0303b039-9a96-4e81-b656-536c53399068,LONG ISLAND ICE & FUEL CORP,"For quality ice cube wholesaler and ice cube distributor services, Long Island Ice and Fuel is your best choice. We maintain a high level of quality control and production standards in all our operations and providing the finest service available.",http://www.icefuelli.com,,,
ff2f1498-37a5-4f83-8b62-b111442c819b,Cat & Cloud Coffee,,http://www.catandcloud.com,http://www.catandcloud.com,https://instagram.com/catcloudcoffee,
88b7a334-3175-4fe9-96a1-cfc03e87cc79,Baron Chocolate,,http://www.baronchocolate.com,http://www.baronchocolate.com,https://instagram.com/baronchocolates,
ce3b1715-bf92-4cf7-93cc-2dca29b8b9ed,Jittery Joe's Coffee,"Jittery Joe's is an Athens, GA based retail and wholesale coffee company.  The Company has 20 cafes and a wholesale roasting operation primarily serving the Southeastern U.S.",http://www.jitteryjoes.com,http://www.jitteryjoes.com,https://instagram.com/jitteryjoescoffee,
ee1497d2-9196-4af0-96d7-3448a462bae4,"Pasqualichio Brothers, Inc.","Pasqualichio Brothers, Inc. is the producer of Butcher Van Gourmet meat products. We specialize in case-ready, value-added meat products; offered both under our brand, Butcher Van Gourmet, as well as, private-label. In addition to value-added products, we offer multiple steak programs, featuring individually packed, hand-cut steaks, available in a wide variety of grades and claims. Our product lines are carried by various retail chains and food service distributors across the US, as we offer LTL delivery anywhere in the country.  Pasqualichio Brothers, Inc., currently operates out of a new 40,000 square foot facility, with an SQF Certification.  The new facility is located in Jessup, PA.",http://www.bvgourmet.com,http://www.bvgourmet.com,,
8688f75c-e926-414e-9c29-d3fb449b3546,Purebread,Makers and bakers of wonderfully delicious breads and baked goods,http://www.goodhappens.ca,http://www.goodhappens.ca,,
9907d8e8-98d4-4096-a627-ef60a58511f3,Cocina Mexicana,,http://www.cocina-mexico.com,http://www.cocina-mexico.com,https://instagram.com/agaveazulcocinamex,
34cf4ac3-32cc-48f6-8755-87fec7bec8d4,The Coffee Hound,"At the Coffee Hound, we are committed to maintaining and growing these relationships by focusing on the quality of product, service, and coffee education-all while remaining open minded to change. As one of the few specialty coffee shops in Central Illinois, we strive to share our passion for specialty coffee with our community. We participate in community events and continue to widen our roasting and wholesale horizons by working with fellow businesses and sharing our coffee experience with them.",http://www.coffeehound.net,,,
f216e28d-da69-4d17-a962-299b50812c85,Freddie Pauls Steakhouse Inc,,http://www.freddiepauls.com,http://www.freddiepauls.com,https://instagram.com/freddiepaulssteakhouse,
c1e6dce7-dd5b-497d-8c91-1ed28cbb766f,Karns Quality Foods,"Since 1959, our locally owned and operated grocery store has been a cornerstone in the community, bringing fresh, high-quality products to our neighbors. With 10 locations, our commitment is to provide not only fresh and wholesome food but also a welcoming environment where everyone who enters feels valued and cared for. As we continue to grow, our roots remain firmly planted in the neighborhoods we serve.",http://www.karnsfoods.com,,,
51b6db53-fe2d-4c21-ac79-c3b1b903077e,Golazo,,http://www.golazoenergy.com,http://www.golazoenergy.com,https://instagram.com/golazoenergy.be,
9125fb62-9503-40ef-a252-36eb965c74f9,OKI,,http://www.feeloki.com,http://www.feeloki.com,,
20ccb0bb-f664-4a11-b5a1-2d9c13f85746,Nico Nobili,"An Italian Dark knight. Imperator of Florence. 😜 Patrón of
Cofylo is a brand of coffee made with the old-fashioned Florentine method. This makes it healthier, tastier, and you can drink it in larger quantities than any other coffee brand.",http://www.cofylo.com,http://www.cofylo.com,,
ae433281-b8c7-4ea5-b72d-b495fee2c6d5,Foursided,,http://www.foursided.com,http://www.foursided.com,https://instagram.com/foursidedchicago,
97e2e2d7-2ef4-4745-86f3-38c55c9dd657,Blue Ribbon Fried Chicken,,http://www.blueribbonfriedchicken.com,http://www.blueribbonfriedchicken.com,https://instagram.com/blueribbonfc,
87c8e29c-e071-4e96-9662-83a4099114f9,American Food Dist Inc,,http://www.afdllc.com,http://www.afdllc.com,https://instagram.com/americanfoods.official,
a4a32ea1-3544-44a5-b1cc-cac6ddb3ca81,Econo Car Rentals,,http://www.econocarrentalstt.com,http://www.econocarrentalstt.com,,
6c321070-dd36-4b06-9f05-908aa4970fd2,Gala Fresh Farms,,http://www.galafresh.com,http://www.galafresh.com,https://instagram.com/galafreshfarms,
c76649d2-bfd8-42f5-968a-8adc27479f0e,Trade Coffee,"Trade is an online coffee subscription platform that allows users to discover, personalize and buy roasted coffee powders.",http://www.drinktrade.com,http://www.drinktrade.com,https://instagram.com/tradecoffeeco,https://www.drinktrade.com/blogs/education/cowboy-coffee-recipe
eede8147-63e5-4be5-b1ef-0baf7aeb7d8b,Just About Foods,"Just About Foods was founded in 2019 with the purpose of promoting a lifestyle where natural, healthy, low carb products become part of peoples day to day without giving up on tastiness. Our products are directly sprouted from the fields, with the simplest & most natural processes. From organic to convetional all of our products are plant based, additionally, Non-Gmo, naturally gluten free, naturally vegan & Kosher certified.  Today, our products are offered within the US & Centric Canada. 
We never use any additives or preservatives, so you know you are always getting just what nature has to offer.

To learn more about Just About Foods, visit https://www.justaboutfoods.com/, or follow the brand on Instagram (@Justaboutfoods_) and Facebook (@Justaboutfoods).",http://www.justaboutfoods.com,http://www.justaboutfoods.com,https://instagram.com/justaboutfoods_,
7f0eed8c-61cf-4957-a2f7-231f0b9a5e27,Suerte Tequila,"Suerte Tequila is an award winning brand produced in the highlands of Jalisco at NOM 1530. Suerte is a single distillery making 100% pure Blue Weber Agave tequila the old way: slow cooked in a traditional brick oven, processed using a traditional Tahona wheel, slowly fermented and double distilled. 

Please visit our website http://drinksuerte.com
You can also find us on https://www.instagram.com/suertetequila/",http://www.drinksuerte.com,,,
e13b30c1-e0e0-4b66-a732-6b99bc334d38,The STIL,,http://www.ilovethestil.com,http://www.ilovethestil.com,https://instagram.com/ilovethestil,
e18f27c0-3f98-4d44-932a-07e0d3b76379,Jonathan's Grille,"Established in 1999, Jonathan's Grille is a family-owned, upscale sports grille based in Nashville, Tennessee. We are committed to providing the best sports bar experience through a commitment to higher quality food & service.
​
Our restaurants provide two different settings - first, a bar with enough tv's to catch any game and second, a restaurant providing an upscale, yet comfortable setting for any group of family or friends. 
 
We take great pride in providing an experience to customers with a clean, inviting space and quality, fresh food. We are honored to have you dine with us and look forward to providing an awesome meal!",http://www.jonathansgrille.com,,,
5d744032-430a-477a-bee9-5d23828875a6,"The Dean's List, LLC","Dallas/Ft. Worth based on line retailer of wine. Provide great wines at value prices delivered to home via local delivery or shipping to 38 states in US. 

We source wine from around the world in large quantities, exclusive deals, or limited supply, at reduced cost and passing those savings along to our subscription base. 

We also work with charities with our ""Taste, Buy, Give"" functions where we shaped an event around wine and give proceeds of all sales to the charity organization. These functions can be 200+ people and The Dean's List provides the food, wine, staff, and even location.",http://www.deanswinelist.com,,,
8019f552-d89f-4cf8-8a80-bac3c3f5400d,BRICK 29,,http://www.brick29.com,http://www.brick29.com,https://instagram.com/brick_29,
79769898-6429-4973-ac0b-e16f15625504,RAMONA,,http://www.drinkramona.com,http://www.drinkramona.com,https://instagram.com/drinkramona,
943c168c-942b-45d8-8acc-b09a8353e47a,INK COFFEE COMPANY,,http://www.inkcoffee.com,http://www.inkcoffee.com,https://instagram.com/inkcoffee,
46f91a07-a5c3-406c-821c-a7ae6d0129e5,Olam Spices & Vegetables Inc.,,http://www.gilroyfoodsandflavors.com,http://www.gilroyfoodsandflavors.com,,
84f0bfb2-28b9-4499-ab58-b05f5a2c27dc,KBI - Nationwide Beverage Service,"KBI, Nationwide Beverage Service, provides sales, preventive maintenance, service and installation of beverage equipment, including equipment refurbishment.

With over 300 highly trained service technicians, our company services the entire nation. Our network of offices nationwide are capable of offering same day ""reactive"" service for all beverage and coffee needs.

KBI handles numerous lines of equipment including Bunn, Multiplex, Cornelius, Everpure, Cuno and more.",http://www.kbibeverage.com,,,
0a448e66-1989-44dd-8fe3-72e8fe1f6716,DJ'S BOUDAIN INC,,http://www.djsboudain.com,http://www.djsboudain.com,https://instagram.com/djsboudain,https://djsboudain.com/blogs/recipes
7bc26f40-fd9d-4a77-b1f7-dd30fe8be835,Jerrys Supermarket,,http://www.jerrysofsanibel.com,http://www.jerrysofsanibel.com,https://instagram.com/jerrys_foods,https://www.jerrysfoods.com/recipes
ca404de6-c080-4e88-9e9b-0c9a05335ec9,Katzinger's Delicatessen LLC,"Our Sandwiches are famously big & delicious… …and come in two sizes to please any appetite and budget! All sandwiches come with help-yourself-from-the-pickle-barrel traditional ""dill"" or ""garlicky"" new pickle.",http://www.katzingers.com,,,
c5f603c3-6c7d-4211-920d-a66c378d2544,"Pervine Foods, LLC","Pervine Foods, LLC. is the parent company of Chef Robert Irvine's FITCRUNCH®, which is a line of delicious high protein bars, powders, and snacks. Created by co-founder and celebrity Chef Robert Irvine. Sold at all major retailers in the USA.",http://www.fitcrunch.com,http://www.fitcrunch.com,https://instagram.com/fitcrunchbars,
5550c7ff-e79e-43a0-8340-b6f6909cd657,Bon Vivant Company,,http://www.bonvivantcompany.com,http://www.bonvivantcompany.com,,
59548b5d-b1fb-4ce4-a976-d2f212d39138,The Coffee Hub,"Your local hub where people come together to enjoy fantastic coffees, caffeine freezers, chargers, homemade fudge, hand dipped ice cream and shakes. 
Hungry for more? Try our outstanding food lineup including grilled paninis, breakfast sandwiches, chicken salad and many others. 
Come back often to check out the latest works from local artists. Our favorite decor are these unique paintings and photos covering our walls. See one you like, you're in luck they are all available for sale.",http://www.coffeehub318.com,,,
d336843e-58e9-47b9-a60f-6c764e068bec,Passanante's Home Food Service,"The Passanante's home food delivery service is designed to save you time and aggravation as you skip the grocery store lines and rest easy knowing you're feeding your family only the best. We're so confident you'll love our steroid and hormone-free meats and 100% organic vegetables that we're giving away free samples of our foods so you can taste before you buy!

Request A Free Sample Here: http://bit.ly/PHFSFB",http://www.homefoodservices.com,http://www.homefoodservices.com,https://instagram.com/passanantesfood,https://www.homefoodservices.com/blog
3c3b9678-bde2-4310-b87d-813fe9d59903,Brown Butter Cookie Company,,http://www.brownbuttercookies.com,http://www.brownbuttercookies.com,https://instagram.com/brownbuttercookiecompany,
3f6ef223-a777-49ff-96d5-369a03913a6d,Center Plate Development Llc,,http://www.centerplate.us,http://www.centerplate.us,,
1942cb23-160e-48ae-b0e2-7f6561d6fc5b,Crestline Bagel Company Inc,,http://www.crestlinebagel.com,http://www.crestlinebagel.com,https://instagram.com/crestlinebagel,
14d0343a-0d11-4761-9bbc-67d4065f47fa,Katalina's,"The Little Cafe(s) with Lots of Local Goodness™ and Home of The Original Pancake Balls™, Katalina's was founded in 2009 by owner Kathleen Day in the oldest gas station in Columbus. She and her motley crew have delivered breakfast, brunch and lunch daily ever since. The tiny cafe is consistently voted one of Columbus' top breakfast spots. The late, great restaurant critic Josh Ozersky said Katalina's was ""proof that local fare doesn't have to be pretentious."" Live, Love, Local™! Katalina's Original Pancake Balls™ were selected to represent Ohio in Food Network's ""50 States of Pancakes"" https://www.foodnetwork.com/restaurants/photos/best-pancakes-in-america
Katalina's, Too! opened in June 2019. Until 2019 and the Covid pandemic, Katalina's saw YTD growth in profit and sales each year. 2021 was its most profitable year ever. After years in the retail fashion insdustry, Kathleen insists on a work-life balance for all her team members, even salaried managers. She prioritizes those values and ""making the world better one little bite at a time"" through local and organic produce and grains and humane meat. Skeptics say these values cut into her bottom line, yet her profit margin is above the industry average, and employee retention and pay is well above the average restaurant. How does she do it? By maintaining her focus on mission, not money. And proving every day that the two don't have to be mutually exclusive.",http://www.katalinas.com,,,
2ce190b2-207b-462b-94be-482365a8145b,The Holy Grail Pub,"Celebrating the art of good food and beer in Plano, TX. Winning ""Best Bar Food"" and ""Best Beer Selection"" awards since 2011.",http://www.holygrailpub.com,,,
