brand_id,brand_name,given_brand_description,given_brand_website,brand_website,brand_instagram_link,brand_recipes_url
faae9991-e983-4e49-80fb-8670025a7db0,Baked of Bloomington,,http://www.bakedofbloomington.com,http://www.bakedofbloomington.com,https://instagram.com/bakedofbloomington,https://www.bakedofbloomington.com/
52452e08-3c9a-49bb-8d07-c305ffe0e649,"The Abbey: Coffee, Music and Art Lounge","The Abbey is an art, music, and coffee lounge in Santa Cru.

The Abbey is located at 350 Mission Street, Santa Cruz, CA 95060. It is part of the red brick church, Vintage Faith. The Abbey is a non-profit establishment, owned and operated by Vintage Faith Church. It is a performance and hangout space for the whole community. All peeps welcome.",http://www.abbeycoffee.org,,,
4d363592-a81a-41f9-a7b3-73e907ce821a,Lavit,"Our revolutionary multi-patented single serve water cooler just got even better. Introducing Waterbar by Lavit, the ultimate beverage system is expected in early 2024. WaterBar is personalizing the way people drink water by providing individualized still and sparking, hot and chilled water and delicious beverages at the touch of a button. Our drinks, including those from leading brands, are crafted with zero preservatives at just 10 calories or less per 12 ounce serving – so consumers are making the smarter choice for health and hydration every time.",http://www.drinklavit.com,,,
0e560bf9-f52d-4287-bda7-b05abcf33fd5,Natural Blend Vegetable Dehydration,"North Carolina Natural Blend Vegetable Dehydration was built in 2014 with the goal of providing premium dehydrated vegetable and fruit products to the pet and human food industries. The facility is both kosher and ASI certified and allows us to utilize 100% of the sweet potatoes we grow. NBVD may specialize in dehydrated sweet potatoes but have the ability to dehydrate almost any vegetable or fruit. The 27,000 square foot facility consisting of 2 storage silos, a produce washing station, 2 commercial grade dicers, 2 large industrial dryers, and a final product staging area.

Our state of the art dehydration process helps preserve all of the nutrients, color, and health benefits better than any other facility in operation today. Natural Blend has the capacity to process 30,000 pounds of raw product per hour, which amounts to 120,000 pounds of finished product in a day.",http://www.hamfarms.com,http://www.hamfarms.com,,
bc0b3a61-7d1a-4f90-ba2b-5f87eb5476ac,The Giumarra Companies,"""We are committed to the people we work with and those we serve. Very simply, we look to provide the best service and work to improve upon it every day.""​

Our brand is Nature's Partner, and the Giumarra Companies strives to live by this promise every day, working together as partners with our customers and growers. We are a family-based produce marketing company working with more than 2,000 growers worldwide. Our 13 sales and operating divisions are each unique in product offering, but all bound under our uncompromising dedication.

Grow with us and join our mission to feed the world in a healthy way.",http://www.giumarra.com,http://www.giumarra.com,https://instagram.com/giumarravineyards,
961b99ec-ca34-4380-8c3e-b374db906802,NAPOLI GROUP LLC,,http://www.beldenrestaurants.com,http://www.beldenrestaurants.com,,
a367db8d-9d5d-4f48-bdab-5a996344e14b,Arabian Farms,,http://www.grandarabian.com,http://www.grandarabian.com,,
b26f2cc4-709e-4e34-ba11-140f222ef769,Curry Hyuga,,http://www.curryhyuga.com,http://www.curryhyuga.com,,
2350f615-13a4-4a70-b2ab-e176a2e4132d,JG Neil & Co,"J.G. Neil & Co. is your Premier, Locally Owned and Operated, Foodservice Agency. We have been providing the highest levels of sales and service to customers throughout the region since 1973. 

JG Neil & Co is a proud member of the Independent Broker Association.",http://www.jgneil.com,,,
a03e37d6-7eac-498b-8444-1fba9631d2bc,SubZero Nitrogen Ice Cream New England Area Franchise Developers,Mark and Rita McCabe are the New England Area Franchise Developers for SubZero Nitrogen Ice Cream.,http://www.greatwaytoearn.com,http://www.greatwaytoearn.com,,
a475de82-f7b4-4dda-a2ae-04db2fe348f9,Gehrke Company,,http://www.gehrke.com,http://www.gehrke.com,,
ce441f96-90fd-4b2f-806b-0018c6e520ab,Machine Hospitality Group,"Chicago-based hospitality with venues in River North, Wicker Park, and Nashville. Boasting renowned cocktail programs, innovative menus, and one-of-a-kind atmosphere.",http://www.dinemachine.com,,,
92bd2c91-95d4-45a2-814d-91e14c40a03c,Hart County School System,,http://www.hart.k12.ga.us,http://www.hart.k12.ga.us,,
73170d82-3706-483f-b82e-87f18389f3d2,"Citrosuco North America, Inc.",,http://www.citrosuco.com,http://www.citrosuco.com,https://instagram.com/citrosuco.oficial,
840a5d81-7172-4522-82ea-5961fbcb03e4,Brilliant Books,,http://www.brilliant-books.net,http://www.brilliant-books.net,https://instagram.com/brilliantbookstc,
d16acc37-12db-4f79-8bda-9ce219848489,The Cat House,The Cat House is a neighborhood cocktail bar with a beautiful aesthetic and casual atmosphere.,http://www.cathousebar.com,,,
f518e627-151e-4b47-91e9-075079f57855,Frigorífico Confiança,,http://www.frigconfianca.com.br,http://www.frigconfianca.com.br,,
449d731b-124a-4f5e-a4da-3b50c8c3f421,Whitworth Brothers,,http://www.hillcountryrealestatellc.com,http://www.hillcountryrealestatellc.com,,
72197b91-0808-4f74-a64d-b180e8a33141,Excelsior Farm,,http://www.excelsiorfarm.com,http://www.excelsiorfarm.com,https://instagram.com/excelsiorcoffeesf,
7408c832-95a9-44c7-9b62-f3ea092a9c67,"2SISTERS NATURAL FOODS, LLC",,http://www.2sistersnaturalfoods.com,http://www.2sistersnaturalfoods.com,,
3d0ca327-ceb0-48fb-aa5b-7bdb552e2e52,Italian Bakery,,http://www.dangelobakery.com,http://www.dangelobakery.com,https://instagram.com/dangelosbakery,
b820a0ff-4dd9-48e3-8a06-be9bd2c55497,Just Grind®,"Just Grind® fuels ambitious and health-conscious individuals with the energy and support they need to excel and perform at their best.

By nature they are daring, bold, unrelenting, competitive, and unapologetically driven; and can easily be found dominating in various arenas such as entrepreneurship, sports, music, and entertainment just to name a few.

The road to success involves immense pressure, causing most people to fold. For this reason, we believe that success belongs to those who can persist. If that's you, we're here to keep you energized and performing at your best along the way.

Just Grind — Fuel Your Journey!",http://www.justgrind.co,http://www.justgrind.co,https://instagram.com/justgrind,
ff40081a-2fbb-4755-abfc-bfed9610b3ed,Bella Foods,,http://www.bellafoodsproduce.com,http://www.bellafoodsproduce.com,,
bef46306-0afb-4a53-8a46-a441a8befa2c,21st Amendment,,http://www.21stamendment.com,http://www.21stamendment.com,https://instagram.com/21amendment,
1aadfca7-8a52-404b-adac-991db7686dc1,Cypress Hills Cemetery,,http://www.cypresshillscemetery.org,http://www.cypresshillscemetery.org,,
7a8443ab-845b-4bc4-893e-4ba09273bdbb,Bewiched Coffee,,http://www.bewiched.co.uk,http://www.bewiched.co.uk,https://instagram.com/bewichedcoffee,
1535d9d2-871c-4714-8d58-36a4cd066e40,Couto Management Group LLC,,http://www.coutomanagement.com,http://www.coutomanagement.com,,
b20810de-f2c2-48fd-8212-6a75ad186c7e,Milwaukee Ale House,"Milwaukee Ale House is a Food and Beverages company located in 233 N Water St, Milwaukee, Wisconsin, United States.",http://www.ale-house.com,,,
c27dfd86-ba90-48af-9d8c-550589c08e7d,Agrowstar LLC,,http://www.agrowstar.com,http://www.agrowstar.com,,
7ba7c8f1-5e91-49d2-ba8e-a0ede09dd3d3,Calecos Bar & Grill,,http://www.calecos.com,http://www.calecos.com,,
a2d1ab5b-af00-4fe0-8dfc-be54dec204f4,Rookies,"Handcrafted Ice Cream Sandwiches (and a whole lot more).

We don't mess around; our products and our people are made with integrity! You will find no hormones or artificial preservatives added to any of our products. We bake our cookies from scratch on a daily basis and feature our very own homemade ice cream.",http://www.eatatrookies.co,http://www.eatatrookies.co,https://instagram.com/eatatrookies,
c196d17d-a0e2-4bd5-a1e2-32de3d8d824f,JUICE FACTORY,"JUICE FACTORY is a company based out of 89 E 161St St, Bronx, New York, United States.",http://www.juicefactoryvii.com,http://www.juicefactoryvii.com,https://instagram.com/montaukjuicefactory,
f3cdb2af-f03e-4e77-b371-4da626c24468,Northside Pub,,http://www.glensidepub.net,http://www.glensidepub.net,https://instagram.com/northsidetavernob,
a628ed5c-394d-4dae-a4c1-24d30312011e,Cascade Roadhouse,,http://www.cascaderoadhousemi.com,http://www.cascaderoadhousemi.com,https://instagram.com/cascaderoadhousegr,
597513d1-caf4-4e03-b9c1-9990dedb1fb8,Juice Stop,Juice Stop is a Sioux Falls restaurant that features a large selection of real fruit smoothies so you can be confident to find the perfect flavor for you. Our mission is to provide people of all ages with healthy REAL FRUIT SMOOTHIES that taste amazing and promote a happy and healthy lifestyle.,http://www.juicestopsiouxfalls.com,,,
0ff71bda-42f9-492f-a183-016f23638451,Buckhorn Bar & Grill,,http://www.buckhorngrillandbar.com,http://www.buckhorngrillandbar.com,https://instagram.com/buckhornbarandgrills,https://buckhorngrill.com/
0399ce6f-12e9-4152-a6c8-700e21cbb2ac,Joseph Victori Wines Inc.,"Joseph Victori Wines, Inc is an importer of fine wines from Chile, Italy, Germany and many more. Customers enjoy our products around the world as well as 40+ states in the U.S. We are a fourth generation family business building this company one case at a time. If you are interested in growing with us please reach out.",http://www.jvwines.com,,,
4bbe4382-809c-4691-ad90-dd3d9eba900f,The International Foodservice Distributors Association (IFDA),"The International Foodservice Distributors Association (IFDA) is the premier trade organization representing the foodservice distribution industry. With a combined annual sales volume of $382 billion, foodservice distributors play a crucial role in our nation's infrastructure. This industry ensures a safe and efficient supply chain of food and products for more than one million restaurants and foodservice outlets in the U.S. every day. IFDA member companies operate more than 800 facilities in all 50 states, the District of Columbia, and around the world.  For more information visit: http://www.ifdaonline.org/",http://www.ifdaonline.org,,,
ca0f7f2e-d099-4b32-989b-0524e84d6bec,SAUZ,For a New Generation of Tomato Sauce.,http://www.getsauz.com,http://www.getsauz.com,https://instagram.com/getsauz,https://getsauz.com/blogs/recipes
c77481d9-1c80-444d-b238-f1527dd5d6cc,Sweet Affair,"Sweet Affair is an Information Technology and Services company located in 1357 State Ave, Marysville, Washington, United States.",http://www.asweetaffairbakery.com,,,
f8cd22d9-c83c-4038-8923-70da027da9b5,"John B. Sanfilippo & Son, Inc.","Our Mission: 
We're nuts about creating real food that brings joy, nourishes people, and protects the planet.

John B. Sanfilippo & Son, Inc. is a growing leader in the snack food industry known internationally for the Fisher® brand name. We are a processor, packager, and marketer of a wide variety of nut and snack products.

Sanfilippo offers a unique corporate culture that is an exciting combination of a family-based atmosphere, a publicly traded corporate structure, and a growing organization that is expanding its sales and operations expertise's to better serve our national customers and consumers.",http://www.jbssinc.com,http://www.jbssinc.com,https://instagram.com/fishernuts_jbss,
bdeb325d-4818-4c3d-97fb-a25b8511ff45,COMON CAJAF,,http://www.comoncajaf.com,http://www.comoncajaf.com,,
b0574643-f712-41f5-a89a-4333a1784219,Protein2o Inc.,"We created Protein2o as a crazy idea. We thought there must be a better way to consume the two nutrients most important to our bodies — water and protein – without a lot of unnecessary calories.

We're proud to be a small but experienced, Chicago-based company dedicated to doing the right thing. Our mission seeks to improve people's lives by providing great tasting drinks that promote a healthy, active lifestyle through the daily use of protein. When many large companies cut corners, we don't. When other companies exaggerate their product benefits, we won't.

We quite simply make low-calorie, great tasting protein water. And we have fun doing it! We hope you give us a try and enjoy a refreshing take on protein.",http://www.drinkprotein2o.com,http://www.drinkprotein2o.com,https://instagram.com/protein2o,
8b6c9bdb-ec70-4c75-8191-283b07927470,Iron Horse Bar & Grill,,http://www.ironhorsebar.com,http://www.ironhorsebar.com,https://instagram.com/ironhorsebarandgrillllc,
5f254bf1-227f-407f-bcfa-de12f45daac3,Brewsters,,http://www.brewsters-hub.com,http://www.brewsters-hub.com,,
6e2a7286-6252-4967-b778-b88c845c3e43,Bistro 112,,http://www.bistro112.com,http://www.bistro112.com,https://instagram.com/bistro112,
49c76d56-973f-4bdc-bd87-e932df633823,FIVE STAR CORRECTIONAL SERVICES,,http://www.fivestarcorrectional.com,http://www.fivestarcorrectional.com,,
b0a94ddf-1d28-458a-b572-4f106788eac1,Southern Corporate Packers,,http://www.floridamelons.com,http://www.floridamelons.com,https://instagram.com/scp_produce,
0c74ff0a-55f3-4cd7-857a-289be5851248,"Cascade Specialties, Inc.",,http://www.cascadespec.com,http://www.cascadespec.com,,
93742f54-d65f-41d3-bd48-4e685df26153,Blue Bunny Ice Cream Parlor,,http://www.ilovewells.com,http://www.ilovewells.com,https://instagram.com/blue_bunny,
57ebfa16-a80f-42e0-81a0-f887d3a32aa9,Jim Causley Pontiac GMC Truck,,http://www.jimcausley.com,http://www.jimcausley.com,https://instagram.com/jimcausley,
22af9b65-3157-4571-9157-5eee2bdeab19,Jims Burgers,,http://www.jimsburgerslb.com,http://www.jimsburgerslb.com,https://instagram.com/jimsburgerslb,
832e5e8b-568d-4741-9e07-fd5abbcc43c1,"FreshPoint South Florida, Inc.",,http://www.freshpointmarketing.com,http://www.freshpointmarketing.com,,
538494ed-3f69-4886-b820-213aa27ff8e8,NADI,"NADI is the maker of NADI USDA Certified Organic Wild Rosehip Drinks and all-natural Happy Hearts crispy dried apple chips. NADI is a social venture that creates jobs for displaced refugees and a WBENC certified woman-owned business founded by Nina Tickaradze, who is a native of the country of Georgia. The name NADI means ""collective work effort"" in the Georgian language to honor the refugees, family and friends who make our healthy products possible. To learn more, please visit www.getnadi.com.",http://www.getnadi.com,http://www.getnadi.com,https://instagram.com/officialnadi,
39a4ffd0-6f4a-4453-ac70-9fd52f1def7d,vina falernia limitada,,http://www.falernia.com,http://www.falernia.com,,
c053284e-76b8-46fe-af11-56497d940451,Conservatory,,http://www.conservatoryhtx.com,http://www.conservatoryhtx.com,https://instagram.com/theconservatorynyc,https://themushroomconservatory.com/the-ultimate-gourmet-mushroom-mac-cheese-recipe/
f64e581e-0c47-4b82-ab58-b5b5c23da5f7,The Free Spirits Company,"The Free Spirits Company was founded to answer one simple question: ""What if alcohol wasn't the star player of every great cocktail?"" We make a full line of hand-crafted, complex, bold expressions of the spirits that so many of us love. Minus the alcohol. Now, drinkers don't have to chose between more great cocktails or less alcohol. DRINK LIKE YOU MEAN IT.",http://www.drinkfreespirits.com,,,
738f0753-ae77-4227-ac5e-6a08b5f830a9,Joystick,"Joystick is a company based out of 427 EDGEWOOD AVE SE , ATLANTA, Georgia, United States.",http://www.joystickgamebar.com,,,
c8145ff1-6803-4e7a-9ba5-772828cced3c,New Trend Foods,"New Trend Foods is a Food and Beverages company located in 4500 N 10th St # 50, Mcallen, Texas, United States.",http://www.gendai.com.br,http://www.gendai.com.br,,
6b9c55aa-6426-4324-95a3-437663fb7723,"Deerfield Retirement Community, Inc.",,http://www.deerfieldrc.com,http://www.deerfieldrc.com,,
ef2b44d9-afa6-4b7d-b6e0-44bace3b2944,Missoula Winery,"We do French style wines.
We have weekly music. Thursday night open mic and Friday night concerts
We host (outdoor and indoor) events such as: Weddings, Birthdays, Showers, Food/Wine pairings, corporate meetings,....
We promote local artists by displaying their arts on our 20 feet tall walls.
Our facility is roughly 11,000 sq.ft, with 5,000 sq.ft for events and 6,000 for wine production.
We have a bottle recycling program with local restaurants.",http://www.bloopfrozenyogurt.com,,,
a60d481a-c1d5-4e18-b300-39dcb9c3089c,Mmmly,"Mmmly makes modern, nutrient-dense, premium products inspired by a real story from its founder, Nick. Mmmly's first offering is a delicious line of soft indulgent cookies that are sweetened with apples, gluten-free, grain-free, and full of healthy prebiotics.",http://www.eatmmmly.com,http://www.eatmmmly.com,https://instagram.com/eatmmmly,https://www.eatmmmly.com/
e46f978c-3876-42fe-9711-c7d5821a4c63,"New Columbia Fruit Packers, LLC",,http://www.columbiafruit.com,http://www.columbiafruit.com,,
0ee1c9d6-f585-421b-b33a-992babdddf35,Old Town Public House,"Old Town Public House (OTPH) is a community pub specializing in craft beer, boutique wines, and nightly live entertainment.",http://www.drinklivemusic.com,,,
88ad09be-ed56-4ef1-b164-73be2e595f94,JOH,"JOH is one of the strongest regional brokers in America with an unrivaled presence along the entire East Coast. We are extremely focused on finding profitable solutions for both our clients and customers. At JOH we deeply believe in selling the right way, with passion and integrity.

Our teams represent each manufacturer with tenacity and respect. We deliver on all fronts by offering the best in headquarter sales, retail merchandising and extraordinary access to key decision makers. JOH is a dedicated and strong company that is Driven To Sell Right.",http://www.johare.com,,,
71193d14-c46b-4dc5-9878-1f635fdd4843,A.D. Bos Vending Services,,http://www.adbos.com,http://www.adbos.com,https://instagram.com/adbosvending,
f6ef7472-089c-40eb-bd93-f39650a9d805,Atlas Edible Ice Raub,,http://www.atlasedibleice_raub.com,http://www.atlasedibleice_raub.com,,
f67c8980-b10b-4386-b11e-4e293c702dee,John's Market,John's Market ™ is a wholesaler of fine fruits and vegetables. Since 1994 John's Market has been providing restaurants and hotels with the level of service and the quality of produce that satisfies the demands of the finest chefs in New York City and the surrounding area.,http://www.johnsnyc.com,,,
2fbbe259-04bc-4365-a393-79268d86ef7e,Joe's Butcher Shop and Fish Market,,http://www.joesbutchershop.com,http://www.joesbutchershop.com,https://instagram.com/joes_butchershop,
409c750b-bef3-467a-9e85-d521e88ea347,"Coosemans New York, Inc.",,http://www.coosemansnewyork.com,http://www.coosemansnewyork.com,https://instagram.com/Coosemansny,
74e55b24-8b39-43a3-b21c-8922f60aadc8,Relentless Trade Solutions,"We are your in-store brand builder. Relentless goes back to the basics of how brands are built; one bottle at a time. Our team of ""Sharks"" are trained with proven processes by the best people in the business to dominate at the store level. We follow productive routing and focused store lists to maximize sales + brand building. We are continuously training to ensure maximized results.",http://www.atplaycreative.com,,,
0e66912b-0a73-4878-b745-dd8748d8a840,One World Enterprises,"It all started in 1982, when Jeff Mease was an IU undergrad working for Domino's Pizza. As he rolled corporate dough and spread store-bought sauce, he realized he could make a better product and break the monopoly Big Pizza held on the campus market.

Thus was born, with the help of Jeff's partner Lennie Busch, the first Pizza Express. Its from-scratch, by-hand pizza won an instant following, a rare feat for a small business in the quick-serve dining world. Now with five locations (under the new, trademarkable name Pizza X), it remains Bloomington's favorite pizza delivery service nearly 30 years later.

Since the  opening of Pizza X (formerly known as Pizza Express), OWE has opened a different restaurant called ""Lennie's""​, as well as OWE KitchenShare and OWE Catering and Events.

The future of OWE will include continued movement toward greater sustainability and community-sourced ingredients. What it won't hold is any sort of expansion that looks beyond the Bloomington area. We have no desire to get bigger, only to become a more integral, responsible, and valued part of the Bloomington community.",http://www.bloomington.com,,,
8362c1e3-aa44-4e18-964d-39ea5e2e2291,Just Candy LLC,"OUR SWEET STORY

Just Candy LLC is an e-commerce retailer specializing in bulk candy and candy gifts. Our history is sweet, melting the expertise of a 20-year-old, established candy e-retailer with the fast-growth, entrepreneurial leadership of a large national party supplier. 

Steve Mandell, Founder & former CEO of Party City, and former CEO & Board Chairman of Costume SuperCenter, has spent his life's work building businesses dedicated to making events more memorable. With Mr. Mandell spearheading the launch of JustCandy.com we are positioned for rapid growth.   

MAKING EVERY OCCASION SWEETER

Any celebration will become extra sweet with treats from Just Candy. Whether celebrating a birth or birthday, marriage, graduation or retirement, you can find a vast delectable selection of top-name candy brands to make your occasion even more memorable, including: 
• HERSHEY's, REESE's, and KISSES chocolates gift sets and bulk by weight 
• Jelly Belly jelly beans in bulk by color 
• Chocolate ""cigars"" with ""It's a Boy"" or ""It's a Girl"" 
• HERSHEY's HERESHEIS and HEREHEIS baby announcement chocolate bars 
• Vivid foil-wrapped OREO cookies drenched in Belgian chocolate 
• Madelaine milk chocolate hearts and starts wrapped in festive foil – beautiful additions to a candy bar 

All occasions, all ages, all places—we can cater to every one of your event and gift giving needs. Whatever the celebration, Just Candy is here to make it an extra special one! 

OUR TEAM

We're not trying to candy-coat things; our goal really is to host an environment where our core values are realized each day: Innovation, Integrity, Teamwork, Financial Strength, Quality of Service and Giving Back. At Just Candy, these values are not just lofty words, but truly embraced and ingrained in our culture. Our office is busy with explosive growth, and we work hard to get things done all while focusing on giving our customers a real treat.",http://www.justcandy.com,http://www.justcandy.com,https://instagram.com/iamicandy_,
136f6ef0-c2a8-4b18-9aa7-77d107bde78e,The Copper Pot,"People have asked: ""What type of restaurant are you?""
Our answer: ""The type that makes good food.""
Since November 2007, Chef Jeff Morris and his team pride themselves on preparing creative dishes with proper technique utilizing only the freshest and best ingredients. Most items on the menu are garden-grown ingredients and house made recipes.
The Copper Pot Family Strives to Accomplish the following goals:
Always serve fresh food at fair prices
Make it from scratch whenever possible
Prepare seasonally fresh yet creative specials
Provide interesting selections of the finest craft beers and wines",http://www.copperpotrestaurant.com,,,
716dcaf1-5c09-4293-953d-044fb30e660f,Worthington,"Worthington Foods, Inc., has grown from a tiny manufacturer of specialty foods into a leader of the U.S. markets for vegetarian foods and meat alternatives. The business traces its heritage to 1939, when Dr. George T. Harding III founded Special Foods in Worthington, Ohio. Harding established Special Foods to supply vegetarian foods to his father's nearby sanitarium (health spa). With companies like Michigan's Battle Creek Foods Company, Tennessee's Madison Foods, and California's Loma Linda Foods as models, Harding, his wife Mary Virginia, and four other investors bought and refurbished a fire-damaged house and started production in 1939.

Special Foods' early products were fashioned after ""nut meats,"" first concocted by Dr. John Kellogg, the first Adventist to become a medical doctor. They combined roasted peanuts with gluten (derived from flour) and seasonings to form meatless, yet high-protein main courses like PROAST, a substitute for dark meat, and NUMETE, a substitute for light meat.

Worthington Foods was aquired by Heritage Health Food in 2016, and continues to innovate and grow in the vegetarian food industry. 

Worthington is committed to producing high quality, vegetarian products to promote healthful living. Aspiring to be the ""World's Best!"", Worthington seeks to expand the options for those pursuing a meatless, plant based lifestyle and satisfy the tastebuds of all who partake.",http://www.eatworthington.com,http://www.eatworthington.com,https://instagram.com/worthingtonfoods,https://serveworthington.com/recipe-search/
936d9ad6-16e2-4a9a-bebc-596d571c16b0,"Deb-El Food Products, LLC",,http://www.debelfoods.com,http://www.debelfoods.com,https://instagram.com/leanadeebb,
487ef5d7-fd3b-42b4-ae47-372025afe21c,close harbour seafood,,http://www.closeharbourseafood.com,http://www.closeharbourseafood.com,https://instagram.com/closeharbour,
cb4510c8-be59-4cdd-8c7d-d405a5189a9d,Mighty Kind Company,Mighty Kind Company is a holistic beverage maker dedicated to creating the world's finest cannabis-infused drinks using hemp derived THC and CBD.  Drink Mighty Kind -- BeMightyKind.com,http://www.bemightykind.com,http://www.bemightykind.com,https://instagram.com/bemightykind,
ccc4c31a-c677-4fc4-8070-616e4bc785df,Cal Java Coffee Roasters,,http://www.caljavacoffeeroasters.com,http://www.caljavacoffeeroasters.com,https://instagram.com/caljavacoffee,
34416442-4497-40d4-8ba2-1f2baba3dd0f,Continenteranch.com,,http://www.continentenut.com,http://www.continentenut.com,,
